id,target_name_ar,sentence,subject,relation,object,evidence,split
267,عبدالرحمن سالم العتيقي,"1976ويعمل به اعتبارا من اول يوليو سنه نايب امير الكويت جابر الاحمد الجابر الصباح نايب رييس مجلس الوزراء جابر العلي السالم الصباح وزير الماليه عبد الرحمن سالم العتيقي ه 1396 ذو الحجه7صدر بقصر السيف في م1976 نوفمبر28الموافق IN THE NAME OF GOD, THE COMPASSIONATE, THE MERCIFUL Law Decree No",,,,,
268,منيزل جاسر فجري العنزي,الموسوعه الحره معلومات شخصيه اسم الولاده منيزل جاسر فجري العنزي الميلاد 1939 تاريخ الوفاه 16 ابريل 2025 (86 سنه) الجنسيه الديانه مسلم الحياه العمليه المدرسه الام ليسانس في الحقوق المهنه سياسي الحزب قبلي,,,,,
269,ناصر  المطيري,10:18 المطيري مشاركا في الجلسه العامه للمنتدا الرياضي اعتبر الامين العام لحوار التعاون الاسيوي السفير ناصر المطيري امس,,,,,
270,راشد سالم العميري,عضو المجلس الاعلا للبترول 1987 رييس قسم الهندسه الكيمياييه في جامعه الكويت 1983 1985 وزير النفط في دوله الكويت عام 1992 مراجع ^ راشد سالم العميري نسخه محفوظه 2020-02-08 علا موقع واي باك مشين ^ نسخه محفوظه 2019-02-11 علا موقع واي باك مشين بوابه السياسه بوابه الكويت بوابه اعلام هذه بذره مقاله عن موضوع له علاقه بسياسي او سياسيه من الكويت بحاجه للتوسيع,,,,,
271,راشد سالم العميري,احمد سعد حجا العميري مشاري حمود راشد الشويرد العميري داود سلمان العميري غانم مبارك العميري نايب فلاح سعيد سالم العميري راشد سالم العميري وزير حامد سعود محمد شويرد العميري عايشه غانم مبارك العميري نبيله سلمان انقيان سالم العميري عبداللطيف عبدالوهاب عبدالرحمن مبارك العميري سني نايب محمد حسين علي العميري حامد عبدالرحمن علي خليفه العميري سعود عبدالعزيز محمد سعد سالم العميري عيسا محمد عبدالرزاق محمد العميري Comments & Questions Michael Herb,,,,,
272,جاسم الاستاذ,(النهايه) م س ع / ط ا ب وزير الكهرباء والماء والطاقه المتجدده ووزير الاشغال العامه بالتكليف الدكتور جاسم الاستاذ مع عدد من قيادي وزاره الاشغال العامه الوزير خلال الجوله مع مهندسي المشروع مستشفا الولاده الجديد موجز الاخبار الكويت,,,,,
273,سعاد الفضلي,سعاد الفضلي عميد كليه العلوم الطبيه المساعده عبر قناه المجلس 22 يناير 2019 مشاركه,,,,,
274,محمد  الحمد,الموسوعه الحره محمد الحمد محمد الحمد في اخر ايامه اثناء عمله ضابطا بالشرطه الكويتيه سادس رييس لنادي القادسيه الكويتي في المنصب 1966,,,,,
275,محمد  الحمد,1976| محمد الحمد وكيل وزاره الكهرباء ل«القبس»: 3 اختيارات امام اصحاب العمارات لتوصيل المياه الا الشقق السكنيه,,,,,
276,محمد عوض عبيد محمد سالم الرقيب المطيري,الموسوعه الحره معلومات شخصيه اسم الولاده محمد عوض عبيد محمد سالم الرقيب المطيري تاريخ الميلاد (العمر 44-45) الجنسيه الكويت الديانه الاسلام الحياه العمليه المهنه سياسي تعديل مصدري,,,,,
277,محمد عوض عبيد محمد سالم الرقيب المطيري,تعديل محمد عوض عبيد محمد سالم الرقيب المطيري ( -) سياسي كويتي,,,,,
278,عبدالله علي,الموسوعه الحره معالي الشيخ عبدالله علي العبدالله السالم الصباح,,,,,
279,عبدالله علي,تعديل الشيخ عبدالله علي العبدالله السالم الصباح,,,,,
280,عبدالله علي,A+ Aعام السيره الذاتيه لوزير الدفاع الشيخ عبدالله علي عبدالله السالم الصباح 04/02/2025 LOC12:52 09:52 GMT الكويت,,,,,
281,عبدالله علي,2 (كونا) -- صدر مرسوم اميري بتعديل وزاري نص في مادته الثانيه علا تعيين الشيخ عبدالله علي عبدالله السالم الصباح وزيرا للدفاع وفيما يلي سيرته الذاتيه: حاز الشيخ عبدالله علي عبدالله السالم الصباح درجه البكالوريوس تخصص اداره الاعمال من جامعه البحرين,,,,,
282,عبدالله علي,كما نصت الماده الثانيه علا تعيين عبدالله علي عبدالله السالم الصباح وزيرا للدفاع,,,,,
283,طلال المطيري,خلال كلمته بافتتاح الدوره ال 28 للجنه الميثاق العربي طلال المطيري: جهود الكويت في حمايه حقوق الانسان تعكس التزامها بالنظام العربي 4 ديسمبر 2025 المصدر : الانباء A+ Aاضغط هنا لقراءه ملخص الموضوع X نجاح في عمليه تلخيص الموضوع حدث خطا,,,,,
284,طلال المطيري,الرجاء اعاده المحاوله لا يوجد نتايج في عمليه تلخيص الموضوع رييس اللجنه العربيه الدايمه لحقوق الانسان السفير طلال المطيري القاهره,,,,,
285,طلال المطيري,هناء السيد اشاد رييس اللجنه العربيه الدايمه لحقوق الانسان السفير طلال المطيري امس الاربعاء بجهود الكويت في تعزيز وحمايه حقوق الانسان,,,,,
286,طلال المطيري,Pocket اكد مندوب دوله الكويت الدايم لدا جامعه الدول العربيه السفير طلال المطيري ان انضمام دوله الكويت الا الجامعه العربيه في 20 من يوليو عام 1961 مثل لحظه تاريخيه عززت الاعتراف باستقلال البلاد وسيادتها ورسخت هويتها العربيه,,,,,
287,طلال المطيري,وفي تصريح عبر الهاتف ادلا به مندوب دوله الكويت الدايم لدا جامعه الدول العربيه السفير طلال المطيري لوكاله الانباء الكويتيه لدا مشاركته في عدد من الفعاليات التي اقيمت في ليبيا ضمن ايام طرابلس الاعلاميه ومنها منتدا الحوار الاعلامي العربي الدولي 2025 الذي انطلقت اعماله امس الخميس وافتتاح المتحف الوطني الليبي,,,,,
288,طلال المطيري,الهندي ضروره تفرضها التحديات العالميه 31/01/2026 LOC18:32 15:32 GMT مندوب الكويت الدايم لدا جامعه الدول العربيه السفير طلال المطيري يلقي كلمته خلال اعمال الدوره الثانيه للاجتماع الوزاري لمنتدا التعاون العربي,,,,,
289,طلال المطيري,جاء ذلك في كلمه دوله الكويت التي القاها مندوبها الدايم لدا جامعه الدول العربيه السفير طلال المطيري خلال اعمال الدوره الثانيه للاجتماع الوزاري لمنتدا التعاون العربي,,,,,
290,طلال المطيري,19:37 السفير طلال المطيري اعلن مندوب دوله الكويت الدايم لدا الجامعه العربيه السفير طلال المطيري اليوم فوز مرشح الكويت بعضويه لجنه الميثاق العربي لحقوق الانسان التابعه للجامعه لفتره تمتد اربع سنوات,,,,,
291,ناصر عبدالعزيز حسن صرخوه,الرييسيه / الدواير الانتخابيه / الرميثيه (1981) الرميثيه (1981) عام المجلس الاسم عدد الاصوات النتيجه الطايفه العايله القبيله ناصر عبدالعزيز حسن صرخوه 1 795,,,,,
292,غدير محمد محمود غلوم رضا أسيري,الموسوعه الحره غدير اسيري معلومات شخصيه اسم الولاده غدير محمد محمود اسيري الميلاد 17 نوفمبر 1977 (العمر 48 سنه) الكويت الجنسيه الكويت الديانه مسلم الاولاد جبريل معرفي الحياه العمليه التعلم دكتوراه في مجال السياسه الاجتماعيه المدرسه الام المهنه وزير الشوون الاجتماعيه والعمل سابقا الحزب ليبراليه مستقله تعديل مصدري,,,,,
293,غدير محمد محمود غلوم رضا أسيري,الرييسيه / الاشخاص / غدير محمد محمود غلوم رضا اسيري غدير محمد محمود غلوم رضا اسيري الطايفه شيعي العايله اسيري المشاركات في الحكومه الحكومه الوزاره الحكومه 36 وزاره الشوون الاجتماعيه وزيره الشوون الاجتماعيه المشاركات في الانتخابات ومجالس الامه الانتخابات الدايره الترتيب عدد الاصوات النتيجه مجلس الامه 2022 الدايره الاولا,,,,,
294,غدير محمد محمود غلوم رضا أسيري,ليبراليه تحمل حقيبه الشوون الاجتماعيه بالحكومه الكويتيه الجديده غدير محمد اسيري,,,,,
295,غدير محمد محمود غلوم رضا أسيري,مباشر: عينت الكويت غدير محمد محمود غلوم رضا اسيري,,,,,
296,راشد سلمان محمد الهبيدة,الموسوعه الحره معلومات شخصيه اسم الولاده راشد سلمان محمد الهبيده العازمي الميلاد 1948 (العمر 78 سنه) الجنسيه الديانه مسلم الحياه العمليه المهنه سياسي الحزب قبلي مستقل تعديل مصدري تعديل راشد سلمان محمد الهبيده العازمي من مواليد 1948م عضو مجلس امه سابق ترشح 10 مرات 1 حاز علي 4 مرات منها في اعوام المجلس الوطني سنه 1990م 2,,,,,
297,نورية صبيح براك الصبيح,وزير التربيه ووزير التعليم العالي نوريه صبيح براك الصبيح حاصله علا شهاده الليسانس بالاداب والتربيه عام 1975,,,,,
298,عبدالعزيز عبدالوهاب العدساني,1981م عبدالعزيز عبدالوهاب العدساني نايب 1992م و 1996 م عبدالعزيز يوسف العدساني رييس المجلس البلدي و امين عام منظمه المدن العربيه و رييس ديوان المحاسبه رييس نادي كاظمه سليمان العدساني السفير عبدالوهاب يوسف العدساني احمد محمد العدساني وزير الكهرباء والماء منذ عام 1991-1996 ووزير الاشغال العامه منذ عام 1992-1996 ورييس المجلس البلدي الشاعر عبدالرزاق محمد العدساني,,,,,
299,صبيح عبدالعزيز عبدالمحسن المخيزيم,12:33 م مشاركه صدر اليوم الاثنين مرسوم اميري بتعيين وزير الكهرباء والماء والطاقه المتجدده الدكتور صبيح عبدالعزيز عبدالمحسن المخيزيم اضافه الا عمله وزيرا للماليه ووزير دوله للشوون الاقتصاديه والاستثمار بالوكاله,,,,,
300,صبيح عبدالعزيز عبدالمحسن المخيزيم,3 (كونا) -- صدر مرسوم اميري بتعيين الدكتور صبيح عبدالعزيز عبدالمحسن المخيزيم وزيرا للكهرباء والماء والطاقه المتجدده,,,,,
301,صبيح عبدالعزيز عبدالمحسن المخيزيم,محليات Suleiman الاثنين 24 مارس 2025 صبيح عبدالعزيز عبدالمحسن المخيزيم وزيرا للكهرباء والماء والطاقه المتجدده صدر مرسوم اميري بتعيين صبيح عبدالعزيز عبدالمحسن المخيزيم وزيرا للكهرباء والماء والطاقه المتجدده,,,,,
302,صبيح عبدالعزيز عبدالمحسن المخيزيم,صبيح عبدالعزيز عبدالمحسن المخيزيم وزيرا للكهرباء والماء والطاقه المتجدده,,,,,
303,صبيح عبدالعزيز عبدالمحسن المخيزيم,وكان صدر مرسوم اميري بتعيين صبيح عبدالعزيز عبدالمحسن المخيزيم وزيرا للكهرباء والماء والطاقه المتجدده فيما يلي نصه: بعد الاطلاع علا الدستور,,,,,
304,صبيح عبدالعزيز عبدالمحسن المخيزيم,"وزير الكهرباء والماء والطاقه المتجدده الدكتور صبيح عبدالعزيز عبدالمحسن المخيزيم الكويت مميز نشر : الاثنين 24-3-2025م الاثنين 24-3-2025م س س صدر مرسوم اميري بتعيين صبيح عبدالعزيز عبدالمحسن المخيزيم وزيرا للكهرباء والماء والطاقه المتجدده فيما يلي نصه: ""مرسوم رقم 53 لسنه 2025 بتعيين وزير الكهرباء والماء والطاقه المتجدده بعد الاطلاع علا الدستور",,,,,
305,حسين قويعان محمد الشريف المطيري,الموسوعه الحره حسين قويعان المطيري معلومات شخصيه اسم الولاده حسين قويعان محمد الشريف المطيري الميلاد 10 اغسطس 1968 (العمر 57 سنه) الكويت الجنسيه كويتي الديانه مسلم مناصب الحياه العمليه المدرسه الام جامعه الكويت المهنه سياسي,,,,,
306,حسين قويعان محمد الشريف المطيري,النايب حسين قويعان محمد الشريف المطيري النايب حسين قويعان محمد الشريف المطيري المصور : ارشيف,,,,,
307,سعود ارشيد القفيدي كعمي الرشيدي,الموسوعه الحره سعود ارشيد الرشيدي معلومات شخصيه اسم الولاده سعود ارشيد القفيدي كعمي الرشيدي الميلاد 1953 (العمر 73 سنه) الجنسيه الديانه مسلم الحياه العمليه المدرسه الام شهاده الثانويه العامه المهنه سياسي الحزب قبلي,,,,,
308,ضاري عبدالله العثمان,الموسوعه الحره ضاري العثمان وزير العدل والشوون القانونيه في المنصب الامير جابر الاحمد الصباح رييس الوزراء سعد العبد الله السالم الصباح سلمان الدعيج الصباح غازي عبيد السمار نايب ثاني لرييس مجلس الوزرارء ووزير الدوله لشوون مجلس الوزراء في المنصب 1993 رييس الوزراء سعد العبد الله السالم الصباح عبدالرحمن العوضي عبدالعزيز الدخيل معلومات شخصيه اسم الولاده ضاري عبدالله العثمان الراشد الميلاد (العمر 81 سنه) مدينه الكويت الجنسيه الحياه العمليه المدرسه الام ليسانس حقوق,,,,,
309,ضاري عبدالله العثمان,والذي جاء في نصه: ينقل المستشار ضاري عبدالله العثمان المستشار بديوان سمو ولي العهد الا الديوان الاميري,,,,,
310,مبارك عبدالله علي صنيدح العجمي,الموسوعه الحره مبارك عبد الله صنيدح معلومات شخصيه اسم الولاده مبارك عبدالله علي صنيدح العجمي الميلاد 1955 (العمر 71 سنه) الجنسيه الديانه مسلم الحياه العمليه المدرسه الام جامعه الكويت المهنه سياسي,,,,,
311,مبارك عبدالله علي صنيدح العجمي,"رييس عام لجان الانتخابات العامه لقبيله العجمان من سنه 1982 ولغايه 1996 مواقفه في مجلس الامه مجلس الامه الكويتي 1999 1 الموضوع الموقف الكتل اللجان طرح الثقه بضيف الله شرار ( 2003 ضد طرح الثقه طرح الثقه بالوزير الابراهيم ( 2002 مع طرح الثقه تجنيس البدون ( 2000 موافق طلب طرح الثقه بالوزير محمد الجارالله ( 2005 ضد طرح الثقه طرح الثقه بالوزير انور النوري ( 2004 معارض لطرح الثقه مراجع ^ ""مبارك عبدالله علي صنيدح العجمي""",,,,,
312,ضيف الله فضيل ضيف الله ابو رميه,النايب ضيف الله فضيل ضيف الله ابو رميه النايب ضيف الله فضيل ضيف الله ابو رميه المصور : ارشيف,,,,,
313,مي جاسم محمد البغلي,4 يناير 2024 الامير نواف الاحمد الجابر الصباح رييس الوزراء احمد النواف الاحمد الصباح معلومات شخصيه اسم الولاده مي جاسم محمد البغلي مكان الميلاد مواطنه الديانه الاسلام الاب جاسم محمد البغلي الحياه العمليه المهنه سياسيه اللغه الام اللغه العربيه تعديل مصدري,,,,,
314,مي جاسم محمد البغلي,الرييسيه / الاشخاص / مي جاسم محمد البغلي مي جاسم محمد البغلي المشاركات في الحكومه الحكومه الوزاره الحكومه 42 وزاره الشوون الاجتماعيه وزيره الشوون الاجتماعيه الحكومه 41 وزاره الشوون الاجتماعيه وزيره الشوون الاجتماعيه,,,,,
315,مي جاسم محمد البغلي,المنصب فراس سعود المالك الصباح الحكومه 43: 2023 يونيو شوون الاسره والطفوله مي جاسم محمد البغلي الحكومه 42: 2023 ابريل الحكومه 41: 2022 اكتوبر من 16-10-2022 الا نهايه الحكومه شوون المراه و الطفوله وزير دوله لشوون المراه و الطفوله هدا عبدالمحسن الشايجي الحكومه 41: 2022 اكتوبر من تشكيل الحكومه الا 16-10-2022 وزير دوله لشوون المراه و الطفوله Comments & Questions Michael Herb,,,,,
316,مشعان مجبل عواد بطي العازمي,نايب سابق في مجلس الامه الكويتي نبذه شخصيه ترشح العضو السابق مشعان مجبل عواد بطي العازمي في عام 1999 في الدايره الانتخابيه الخامسه والعشرين (ام الهيمان) في انتخابات مجلس الامه وحقق المركز الاول بعدد 463 صوت وفاز,,,,,
317,محمد سالم اجويهل محمد الجويهل,الموسوعه الحره محمد الجويهل نايب سابق في مجلس الامه الكويتي معلومات شخصيه اسم الولاده محمد سالم جويهل محمد الجويهل تاريخ الميلاد 21 يونيو 1969 (العمر 56 سنه) الجنسيه الكويت الحياه العمليه التعلم المعهد العالي للموسيقا المهنه ناشط سياسي تعديل مصدري,,,,,
318,محمد علي,طالع محمد علي (توضيح) والي مصر طاشوز بالتركيه العثمانيه محمد علی پاشا رسم لمحمد علي باشا من سنه,,,,,
319,محمد علي,اياله الروملي الوفاه 2 اغسطس 1849 (80 سنه) قصر راس التين اياله مصر مكان الدفن مسجد محمد علي مواطنه العرق الباني الديانه الاسلام الزوجه امينه هانم عين الحياه خانم الاولاد اسماعيل كامل باشا الاب ابراهيم اغا الام زينب اقرباء الخديوي اسماعيل (حفيد) (حفيد) عايله سلاله الحياه العمليه المهنه قايد عسكري وسياسي ورجل دوله,,,,,
320,محمد علي,ووالي مصر [لغات اخرا] اللغه الام العثمانيه اللغات والعثمانيه والكرديه مجال العمل السياسه وشوون عسكريه الجوايز وسام الصليب الاعظم من رتبه فرانز جوزيف [لغات اخرا] التوقيع ختم محمد علي تعديل مصدري تعديل محمد علي باشا المسعود بن ابراهيم اغا القوللي بالتركيه العثمانيه قوللا محمد علا پاشا وبالتركيه الحديثه Kavalalı Mehmet Ali Paşa وبالالبانيه Mehmet Ali Pasha ),,,,,
321,محمد علي,انفذ محمد علي في اوايل عام 1806م جيشا لمحاربه المماليك في الصعيد بقياده حسن باشا قايد الفرقه الالبانيه,,,,,
322,محمد علي,وانهزمت قوات محمد علي مما ادا الا انسحابها الا جنوب الجيزه,,,,,
323,محمد علي,يذكرون فيها محاسن محمد علي وما كان له من يد في دحر المماليك,,,,,
324,محمد علي,استطاع جيش محمد علي ان يهزم المماليك في اسيوط,,,,,
325,محمد علي,تلقا محمد علي امرا سلطانيا من السلطان العثماني مصطفا الرابع,,,,,
326,محمد علي,فصبت هذه الحادثه في مصلحه محمد علي باشا الذي تمكن من التغلب علا جيش وهابي في بسل,,,,,
327,محمد علي,اضطر محمد علي باشا ان يغادر ويعود الا مصر للقضاء علا حركه تمرد استهدفت حكمه,,,,,
328,محمد علي,طلب السلطان من محمد علي باشا ان يرسل قواته الا اليونان لاخضاع الثوار,,,,,
329,محمد علي,قبل محمد علي باشا القيام بهذا الدور بفعل ان الخطر موجه ضد دوله المسلمين العامه,,,,,
330,محمد علي,لذا فضل محمد علي عزل مصر عن المشكله اليونانيه,,,,,
331,محمد علي,سلطان الدوله العثمانيه منذ سنه 1808 حتا سنه انج 25 وعد محمد علي باشا بتوليته علا لقاء خدماته الجليله للسلطنه,,,,,
332,محمد علي,كان محمد علي يطمح من كل تلك المساعدات والخدمات التي قدمها للدوله العثمانيه ان يمنحه السلطان ولايه من الولايات الكبرا,,,,,
333,محمد علي,ولكن السلطان اكتفا بان اقطع محمد علي جزيره تقديرا لخدماته وتعويضا عن بعض ما فقده في الحرب اليونانيه,,,,,
334,محمد علي,42 وبسبب موقعها علا طريق الحج الا البيت الحرام والراجح ان محمد علي باشا كان يطمح الا ضم منذ عام 1810,,,,,
335,محمد علي,فوعد السلطان محمد علي بان يوليه عليها نظرا لان الحرب في شبه الجزيره كان تورق مضجعه وكان يتطلع الا القضاء علا الوهابيين بسرعه خوفا من ان تودي دعوتهم الا التفرقه بين المسلمين,,,,,
336,محمد علي,انج 26 وربط معظم المورخين بين طلب محمد علي باشا من السلطان عام,,,,,
337,محمد علي,واصدر في الوقت نفسه فرمانا اعلن فيه خيانه محمد علي باشا وابنه ابراهيم للسلطه الشرعيه,,,,,
338,محمد علي,عنديذ نشط ممثلو بريطانيا وفرنسا في التوسط بين السلطان ومحمد علي,,,,,
339,محمد علي,63 واستخدمت علاقاتها الوديه مع مصر لاقناع محمد علي باشا بتسويه خلافه مع السلطان,,,,,
340,محمد علي,وان يكتفي من فتوحه بسناجق صيدا وطرابلس والقدس ونابلس 64 رفض محمد علي باشا وجهه النظر الفرنسيه,,,,,
341,محمد علي,64 المناطق الخاضعه لسلطان محمد علي بعد انتهاء حملته علا بلاد الشام,,,,,
